bodyPart,equipment,level,id,name,target,secondaryMuscles/0,secondaryMuscles/1,instructions/0,instructions/1,instructions/2,instructions/3,instructions/4,instructions/5,secondaryMuscles/2,instructions/6,instructions/7,secondaryMuscles/3,instructions/8,secondaryMuscles/4,instructions/9,secondaryMuscles/5,instructions/10
lower legs,leverage machine,Principiante,0594,elevación de pantorrillas sentado con palanca,calves,soleus,ankle stabilizers,Ajuste la altura del asiento de manera que sus rodillas queden ligeramente dobladas y sus pies apoyados sobre el reposapiés.,Coloque los dedos de los pies sobre el reposapiés con los talones colgando del borde.,Sujete las manijas o los lados del asiento para mayor estabilidad.,Empuja con las puntas de los pies para levantar los talones lo más alto posible.,"Haz una pausa por un momento en la parte superior, luego baja lentamente los talones hasta la posición inicial.",Repita el número de repeticiones deseado.,,,,,,,,,
waist,leverage machine,Principiante,1452,abdominales sentados con palanca,abs,obliques,,Siéntese en la máquina de palanca con la espalda apoyada en la almohadilla y los pies apoyados en el suelo.,Sujete las manijas o coloque las manos sobre las almohadillas laterales para apoyarse.,"Contrae los abdominales e inclínate lentamente hacia atrás, permitiendo que la almohadilla se mueva contigo.","Una vez que la parte superior de tu cuerpo esté en un ángulo de 45 grados, contrae los abdominales y haz un abdominal hacia adelante, llevando el pecho hacia las rodillas.","Haga una pausa por un momento en la parte superior, luego suelte lentamente y regrese a la posición inicial.",Repita el número de repeticiones deseado.,,,,,,,,,
waist,leverage machine,Principiante,0595,abdominales sentados con palanca (almohadilla para el pecho),abs,obliques,,Ajuste la altura del asiento y la posición de la almohadilla del pecho según su comodidad.,Siéntese en la máquina con la espalda apoyada en la almohadilla del pecho y los pies apoyados en el suelo.,Sujete las manijas o barras laterales para mayor estabilidad.,"Contrae los abdominales e inclínate lentamente hacia atrás, permitiendo que la almohadilla del pecho se mueva contigo.","Haz una pausa por un momento en la máxima contracción, sintiendo la tensión en tus abdominales.",Regrese lentamente a la posición inicial contrayendo los abdominales y tirando hacia arriba.,,Repita el número de repeticiones deseado.,,,,,,,
waist,leverage machine,Principiante,3760,abdominales sentados con palanca v. 2,abs,obliques,hip flexors,Siéntese en la máquina de palanca con la espalda apoyada contra la almohadilla y los pies asegurados debajo de las almohadillas.,Coloque las manos sobre las manijas o los lados del asiento para apoyarse.,"Contrae los abdominales y avanza lentamente, llevando el pecho hacia las rodillas.","Haz una pausa por un momento en la parte superior del movimiento, apretando los abdominales.","Regrese lentamente a la posición inicial, permitiendo que su espalda se curve ligeramente.",Repita el número de repeticiones deseado.,,,,,,,,,
upper arms,leverage machine,Principiante,1451,inmersión con asiento de palanca,triceps,chest,shoulders,Ajuste la altura del asiento de manera que sus pies estén apoyados en el suelo y sus rodillas formen un ángulo de 90 grados.,Sujete las manijas de la máquina de palanca con las palmas hacia abajo y los brazos completamente extendidos.,Baje lentamente el cuerpo doblando los codos hasta que los brazos superiores queden paralelos al suelo.,Haz una pausa por un momento y luego vuelve a la posición inicial estirando los brazos.,Repita el número de repeticiones deseado.,,,,,,,,,,
chest,leverage machine,Principiante,0596,mosca sentada con palanca,pectorals,deltoids,trapezius,Ajuste la altura del asiento y colóquese en la máquina con la espalda apoyada contra la almohadilla.,Sujete las manijas con un agarre pronado y mantenga los codos ligeramente doblados.,"Exhala y empuja las manijas hacia adelante, juntándolas frente a tu pecho.","Haz una pausa por un momento, apretando los músculos del pecho.","Inhale y regrese lentamente a la posición inicial, permitiendo que los músculos del pecho se estiren.",Repita el número de repeticiones deseado.,,,,,,,,,
upper legs,leverage machine,Principiante,3759,palanca sentada buenos dias,glutes,hamstrings,lower back,Ajuste la altura del asiento de modo que sus caderas queden ligeramente más altas que sus rodillas.,Siéntese en la máquina con la espalda apoyada contra la almohadilla y los pies apoyados sobre los reposapiés.,Sujete las manijas o los lados del asiento para mayor estabilidad.,"Manteniendo la espalda recta, inclínese lentamente hacia adelante desde las caderas hasta que la parte superior del cuerpo quede paralela al suelo.","Haga una pausa por un momento, luego regrese lentamente a la posición inicial empujando con los glúteos y los isquiotibiales.",Repita el número de repeticiones deseado.,,,,,,,,,
upper legs,leverage machine,Principiante,0597,abducción de cadera con palanca sentada,abductors,glutes,hamstrings,Ajuste la altura del asiento de modo que sus rodillas formen un ángulo de 90 grados.,Siéntese en la máquina con la espalda apoyada en el respaldo y los pies sobre los reposapiés.,Coloque las manos en las manijas laterales para mayor estabilidad.,"Contrae los abductores y lentamente separa las piernas, alejándolas de la línea media del cuerpo.","Haz una pausa por un momento al final del movimiento, luego vuelve a juntar lentamente las piernas hasta la posición inicial.",Repita el número de repeticiones deseado.,,,,,,,,,
upper legs,leverage machine,Principiante,0598,aducción de cadera con palanca sentada,adductors,hamstrings,glutes,Ajuste la altura del asiento y colóquese en la máquina con la espalda apoyada contra el respaldo.,Coloque los pies sobre los reposapiés y sujete las manijas para mayor estabilidad.,"Contrae los músculos aductores y junta lentamente las piernas, apretando la parte interna de los muslos.",Haga una pausa por un momento en la contracción máxima y luego regrese lentamente a la posición inicial.,Repita el número de repeticiones deseado.,,,,,,,,,,
upper legs,leverage machine,Principiante,0599,curl de piernas sentado con palanca,hamstrings,calves,,Ajuste la máquina a su cuerpo y siéntese en ella con la espalda apoyada contra el respaldo.,"Coloque las piernas inferiores debajo de la palanca acolchada, justo por encima de los tobillos.",Sujete las manijas ubicadas a los lados de la máquina para apoyarse.,"Manteniendo las piernas superiores estacionarias, exhale y enrosque las piernas hacia arriba lo más que pueda.",Mantenga la posición contraída durante una breve pausa mientras aprieta los isquiotibiales.,Inhale y baje lentamente la palanca a la posición inicial.,,Repita el número de repeticiones deseado.,,,,,,,
waist,leverage machine,Principiante,0600,abdominales con elevación de piernas sentado con palanca,abs,hip flexors,,Siéntese en la máquina de palanca con la espalda apoyada contra el respaldo y los pies sobre los reposapiés.,Sujete las manijas o barras laterales para mayor estabilidad.,"Contrae los abdominales y levanta lentamente las piernas hacia el pecho, curvando al mismo tiempo el torso hacia delante.","Haz una pausa por un momento en la parte superior, luego baja lentamente las piernas y el torso hasta la posición inicial.",Repita el número de repeticiones deseado.,,,,,,,,,,
shoulders,leverage machine,Principiante,0602,palanca asentada marcha atrás,delts,trapezius,rhomboids,Ajuste la altura del asiento y colóquese en la máquina con el pecho contra la almohadilla y los pies apoyados en el suelo.,Sujete las manijas con un agarre superior y mantenga los brazos ligeramente doblados.,"Exhala y aprieta los omóplatos mientras tiras de las manijas hacia atrás y hacia afuera, alejándolas del cuerpo.","Haga una pausa por un momento en la contracción máxima, luego inhale y regrese lentamente a la posición inicial.",Repita el número de repeticiones deseado.,,,,,,,,,,
shoulders,leverage machine,Principiante,0601,palanca sentada marcha atrás (agarre paralelo),delts,trapezius,rhomboids,Ajuste la altura del asiento y colóquese en la máquina con el pecho contra la almohadilla y los pies apoyados en el suelo.,"Sujete las manijas con un agarre paralelo, con las palmas una frente a la otra y mantenga los brazos ligeramente doblados.","Exhala y aprieta los omóplatos mientras tiras de las manijas hacia atrás y hacia afuera, alejándolas del cuerpo.","Haga una pausa por un momento en la contracción máxima, luego inhale y regrese lentamente a la posición inicial.",Repita el número de repeticiones deseado.,,,,,,,,,,
back,leverage machine,Principiante,1350,Remo sentado con palanca,upper back,biceps,forearms,Ajuste la altura del asiento y los reposapiés a una posición cómoda.,Siéntese en la máquina con el pecho apoyado contra la almohadilla y los pies sobre los reposapiés.,Sujete las manijas con un agarre por encima de la mano y con los brazos separados al ancho de los hombros.,Mantenga la espalda recta y el centro del cuerpo contraído.,"Tire de las manijas hacia su cuerpo, apretando los omóplatos.",Haga una pausa por un momento en el punto máximo del movimiento.,,Suelte lentamente las manijas y vuelva a la posición inicial.,Repita el número de repeticiones deseado.,,,,,,
lower legs,leverage machine,Principiante,1385,Elevación de pantorrillas con sentadilla y palanca sentado en máquina de prensa de piernas,calves,quadriceps,hamstrings,Ajuste el asiento de la máquina de prensa de piernas de manera que sus rodillas estén ligeramente dobladas cuando sus pies estén sobre el reposapiés.,"Siéntese en la máquina con la espalda apoyada contra el respaldo y los pies apoyados sobre el reposapiés, separados al ancho de los hombros.","Coloque los dedos de los pies y las puntas de los pies sobre la plataforma, manteniendo los talones fuera del borde.",Suelte las manijas de seguridad y empuje el reposapiés hacia afuera extendiendo las rodillas.,"Una vez que las rodillas estén completamente extendidas, baje lentamente los talones flexionando las pantorrillas.","Haz una pausa por un momento en la parte inferior, luego empuja el reposapiés hacia arriba extendiendo las pantorrillas.",glutes,Repita el número de repeticiones deseado.,,,,,,,
shoulders,leverage machine,Principiante,0603,prensa de hombros con palanca,delts,triceps,chest,Ajuste la altura del asiento y colóquese en la máquina con la espalda apoyada contra el respaldo.,Sujete las manijas con un agarre superior y coloque las manos a la altura de los hombros.,"Empuje las manijas hacia arriba hasta que sus brazos estén completamente extendidos, pero no bloquee los codos.","Haga una pausa por un momento en la parte superior, luego baje lentamente las manijas hasta la posición inicial.",Repita el número de repeticiones deseado.,,,,,,,,,,
shoulders,leverage machine,Principiante,0869,Press de hombros con palanca v. 2,delts,triceps,chest,Ajuste la altura del asiento y el respaldo de la máquina de palanca a una posición cómoda.,Siéntese en la máquina con la espalda apoyada en el respaldo y los pies apoyados en el suelo.,"Sujete las manijas de la máquina con un agarre superior, con una separación ligeramente mayor que el ancho de los hombros.","Empuje las manijas hacia arriba y hacia adelante hasta que sus brazos estén completamente extendidos, pero no bloqueados.","Haga una pausa por un momento en la parte superior, luego baje lentamente las manijas hasta la posición inicial.",Repita el número de repeticiones deseado.,,,,,,,,,
shoulders,leverage machine,Principiante,2318,Press de hombros con palanca v. 3,delts,triceps,chest,Ajuste la altura del asiento y el respaldo de la máquina de palanca a una posición cómoda.,Siéntese en la máquina con la espalda apoyada en el respaldo y los pies apoyados en el suelo.,"Sujete las manijas de la máquina con un agarre superior, con una separación ligeramente mayor que el ancho de los hombros.","Empuje las manijas hacia arriba y hacia adelante hasta que sus brazos estén completamente extendidos, pero no bloqueados.","Haga una pausa por un momento en la parte superior, luego baje lentamente las manijas hasta la posición inicial.",Repita el número de repeticiones deseado.,,,,,,,,,
back,leverage machine,Principiante,0604,encogimiento de hombros de palanca,traps,shoulders,,Ajuste la altura del asiento y colóquese en la máquina de palanca con la espalda apoyada contra la almohadilla.,Sujete las manijas con un agarre superior y mantenga los brazos rectos.,"Manteniendo la espalda recta, levanta los hombros hacia las orejas lo más alto que puedas.",Mantenga la contracción por un momento y luego baje lentamente los hombros hasta la posición inicial.,Repita el número de repeticiones deseado.,,,,,,,,,,
lower legs,leverage machine,Principiante,0605,elevación de pantorrillas de pie con palanca,calves,soleus,ankle stabilizers,Ajuste la máquina a su altura y párese con los pies separados al ancho de los hombros.,Coloque los hombros debajo de las almohadillas y sujétese de las manijas para lograr estabilidad.,Levanta los talones lo más alto que puedas extendiendo los tobillos.,"Haz una pausa por un momento en la parte superior, luego baja lentamente los talones hasta la posición inicial.",Repita el número de repeticiones deseado.,,,,,,,,,,
chest,leverage machine,Principiante,3758,Press de pecho de pie con palanca,pectorals,shoulders,triceps,Ajuste la altura del asiento y colóquese en la máquina con los pies apoyados en el suelo.,Sujete las manijas con un agarre superior y coloque las manos a la altura del pecho.,"Empuje las manijas hacia adelante hasta que sus brazos estén completamente extendidos, manteniendo los codos ligeramente doblados.","Haga una pausa por un momento, luego lleve lentamente las manijas hacia el pecho, manteniendo el control durante todo el movimiento.",Repita el número de repeticiones deseado.,,,,,,,,,,
back,leverage machine,Principiante,0606,Remo con barra en T y palanca,upper back,biceps,forearms,Ajuste la altura del asiento y la posición del reposapiés para garantizar una alineación adecuada.,Siéntese en la máquina con el pecho contra la almohadilla y los pies apoyados sobre el reposapiés.,"Sujete las manijas con un agarre por encima de la mano, con una separación ligeramente mayor que el ancho de los hombros.",Mantenga la espalda recta y contraiga el centro del cuerpo.,"Tire de las manijas hacia el torso, apretando los omóplatos.","Haga una pausa por un momento en la contracción máxima, luego suelte lentamente las manijas hasta la posición inicial.",,Repita el número de repeticiones deseado.,,,,,,,
back,leverage machine,Principiante,1351,Remo con agarre invertido y barra en T con palanca,upper back,biceps,forearms,Ajuste la altura del asiento y colóquese en la máquina con el pecho contra la almohadilla y los pies apoyados en el suelo.,"Sujete las manijas con un agarre por encima de la mano, con una separación ligeramente mayor que el ancho de los hombros.",Mantenga la espalda recta y contraiga el centro del cuerpo.,"Tire de las manijas hacia el pecho, apretando los omóplatos.","Haga una pausa por un momento en la parte superior del movimiento, luego suelte lentamente y extienda los brazos hacia la posición inicial.",Repita el número de repeticiones deseado.,,,,,,,,,
upper arms,leverage machine,Principiante,0607,extensión de tríceps con palanca,triceps,shoulders,,Ajuste la altura del asiento y colóquese en la máquina con la espalda apoyada contra la almohadilla.,Sujete las manijas con un agarre superior y extienda completamente los brazos frente a usted.,"Manteniendo los brazos superiores estacionarios, baje lentamente los mangos hacia la frente doblando los codos.","Haz una pausa por un momento en la parte inferior, luego empuja las manijas hacia arriba hasta la posición inicial extendiendo los brazos.",Repita el número de repeticiones deseado.,,,,,,,,,,
back,leverage machine,Principiante,1313,fila unilateral de palanca,upper back,biceps,forearms,Ajuste la altura del asiento y colóquese frente a la máquina.,Sujete las manijas con un agarre superior y mantenga la espalda recta.,"Tire de las manijas hacia su cuerpo, apretando los omóplatos.","Haga una pausa por un momento en el punto máximo del movimiento, luego suelte lentamente y extienda los brazos hacia la posición inicial.",Repita el número de repeticiones deseado.,,,,,,,,,,
back,rope,Principiante,0609,Puente de Londres,upper back,shoulders,biceps,Fije la cuerda a un punto de anclaje alto.,Párese de espaldas al punto de anclaje con los pies separados al ancho de los hombros.,"Sujete la cuerda con un agarre superior, con las palmas hacia abajo.","Inclínese ligeramente hacia adelante, manteniendo la espalda recta y el centro del cuerpo contraído.","Tire de la cuerda hacia su cuerpo, apretando los omóplatos.","Haga una pausa por un momento en el pico del movimiento, luego libere lentamente la tensión y regrese a la posición inicial.",forearms,Repita el número de repeticiones deseado.,,,,,,,
upper legs,body weight,Principiante,3013,Puente de glúteos bajos en el suelo,glutes,hamstrings,core,Acuéstese boca arriba con las rodillas dobladas y los pies apoyados en el suelo.,"Coloca los brazos a los costados, con las palmas hacia abajo.","Contrae los glúteos y el centro del cuerpo, luego levanta las caderas del suelo hasta que tu cuerpo forme una línea recta desde las rodillas hasta los hombros.","Haz una pausa por un momento en la parte superior, apretando los glúteos.",Baje lentamente las caderas hasta la posición inicial.,Repita el número de repeticiones deseado.,,,,,,,,,
back,body weight,Principiante,1352,flexión de la espalda baja,spine,glutes,hamstrings,Acuéstese boca abajo con las piernas extendidas y los brazos a los costados.,"Contrae los glúteos y los isquiotibiales y levanta lentamente la parte superior del cuerpo del suelo, curvando la espalda hacia arriba.","Haz una pausa por un momento en la parte superior, luego baja lentamente la parte superior del cuerpo hasta la posición inicial.",Repita el número de repeticiones deseado.,,,,,,,,,,,
upper legs,body weight,Principiante,3582,estocada con salto,glutes,quadriceps,hamstrings,Comience parándose con los pies separados al ancho de los hombros.,"Da un paso hacia adelante con el pie derecho, bajando el cuerpo hasta una posición de estocada.","Impúlsate con el pie derecho y salta en el aire, cambiando la posición de los pies en el aire.",Aterriza suavemente con el pie izquierdo hacia adelante e inmediatamente baja el cuerpo a una posición de estocada.,Continúe alternando entre estocadas y saltos durante la cantidad deseada de repeticiones.,,calves,,,,,,,,
waist,body weight,Principiante,1688,estocada con giro,abs,quadriceps,glutes,Comience parándose con los pies separados al ancho de los hombros.,"Da un paso hacia adelante con el pie derecho, bajando el cuerpo hasta una posición de estocada.","Mientras realizas la estocada, gira el torso hacia la derecha y lleva el codo izquierdo hacia la rodilla derecha.",Haga una pausa por un momento y luego regrese a la posición inicial.,"Repita del otro lado, dando un paso hacia adelante con el pie izquierdo y girando el torso hacia la izquierda.",Continúe alternando lados durante el número deseado de repeticiones.,hamstrings,,,,,,,,
upper legs,body weight,Principiante,0613,Estiramiento de cuádriceps acostado (de lado),quads,hamstrings,,Acuéstese de lado con las piernas estiradas.,Doble la pierna superior y agarre su tobillo o pie con la mano.,Tire suavemente el tobillo o el pie hacia los glúteos hasta que sienta un estiramiento en los cuádriceps.,Mantenga el estiramiento durante 20 a 30 segundos.,Libera el estiramiento y repite del otro lado.,,,,,,,,,,
waist,body weight,Principiante,2312,acostado codo a rodilla,abs,hip flexors,lower back,Acuéstese boca arriba con las rodillas dobladas y los pies apoyados en el suelo.,Coloque las manos detrás de la cabeza con los codos apuntando hacia afuera.,"Contrae los abdominales y levanta la parte superior del cuerpo del suelo, llevando el codo derecho hacia la rodilla izquierda.","Al mismo tiempo, extiende la pierna derecha hacia afuera y levántala del suelo.",Haga una pausa por un momento y luego regrese a la posición inicial.,"Repite el movimiento, esta vez llevando el codo izquierdo hacia la rodilla derecha y extendiendo la pierna izquierda.",,Continúe alternando lados durante el número deseado de repeticiones.,,,,,,,
waist,body weight,Principiante,0620,Elevación de piernas acostado en banco plano,abs,hip flexors,,Acuéstese sobre un banco plano con la espalda presionada contra él.,Coloque las manos debajo de los glúteos para apoyarse.,Mantenga las piernas rectas y juntas y levántelas hacia el techo.,"Haz una pausa por un momento en la parte superior, luego baja lentamente las piernas hasta la posición inicial.",Repita el número de repeticiones deseado.,,,,,,,,,,
waist,body weight,Principiante,0865,elevación de pierna y cadera acostado,abs,hip flexors,,Acuéstese boca arriba con las piernas extendidas y los brazos a los costados.,Coloque las manos debajo de los glúteos para apoyarse.,"Contraiga el centro del cuerpo y levante las piernas del suelo, elevándolas hacia el techo.","Haz una pausa por un momento en la parte superior, luego baja lentamente las piernas hasta la posición inicial.",Repita el número de repeticiones deseado.,,,,,,,,,,
chest,leverage machine,Principiante,1301,máquina de prensa de pecho interior,pectorals,triceps,shoulders,Ajuste la altura del asiento y colóquese en la máquina con la espalda plana contra la almohadilla.,Sujete las manijas con un agarre superior y coloque los codos en un ángulo de 90 grados.,"Empuja las manijas hacia adelante hasta que tus brazos estén completamente extendidos, exhalando durante el movimiento.","Haga una pausa por un momento al final del movimiento, luego regrese lentamente a la posición inicial, inhalando mientras lo hace.",Repita el número de repeticiones deseado.,,,,,,,,,,
upper legs,body weight,Principiante,0624,marcha sentada (pared),glutes,quadriceps,hamstrings,Párese con la espalda contra una pared y los pies separados al ancho de las caderas.,Desliza lentamente la espalda por la pared hasta que las rodillas queden dobladas en un ángulo de 90 grados.,Levanta el pie derecho del suelo y lleva la rodilla hacia el pecho.,"Baje el pie derecho hacia abajo y levante el pie izquierdo del suelo, llevando la rodilla hacia el pecho.",Continúe alternando entre levantar el pie derecho y el izquierdo durante la cantidad deseada de repeticiones.,,calves,,,,,,,,
back,medicine ball,Principiante,1353,Atrapar un balón medicinal y lanzarlo por encima de la cabeza,lats,shoulders,core,Párese con los pies separados al ancho de los hombros y sostenga un balón medicinal con ambas manos a la altura del pecho.,Doble ligeramente las rodillas y contraiga el centro del cuerpo.,"Baje el cuerpo a una posición de sentadilla, manteniendo la espalda recta y el pecho hacia arriba.","Extiende explosivamente tus caderas y piernas, mientras lanzas simultáneamente el balón medicinal por encima de tu cabeza.",Suelta la pelota en la parte superior del movimiento y recógela en el camino hacia abajo.,Baje el cuerpo nuevamente a la posición de sentadilla y repita el ejercicio la cantidad de repeticiones deseada.,,,,,,,,,
chest,medicine ball,Principiante,1302,pase de pecho con balón medicinal,pectorals,shoulders,triceps,Párese con los pies separados al ancho de los hombros y sostenga el balón medicinal a la altura del pecho.,"Extiende los brazos hacia adelante, empujando el balón medicinal lejos de tu pecho con fuerza.","Al soltar la pelota, sigue el movimiento con los brazos y el torso, transfiriendo el peso del pie trasero al pie delantero.",Atrapa la pelota cuando rebota en la pared o en tu compañero y repite el movimiento inmediatamente.,Continúe durante el número deseado de repeticiones.,,,,,,,,,,
chest,medicine ball,Principiante,1303,Empuje de pecho con balón medicinal desde una postura de tres puntos,pectorals,shoulders,triceps,Comience en una posición de tres puntos con una mano sobre el balón medicinal y la otra mano en el suelo.,Extiende las piernas y coloca tu cuerpo en línea recta.,Baje el pecho hacia el suelo mientras mantiene la espalda recta.,"Empuja el balón medicinal lejos de tu cuerpo, extendiendo el brazo completamente.",Regrese a la posición inicial y repita el ejercicio la cantidad de repeticiones deseada.,,,,,,,,,,
chest,medicine ball,Principiante,1304,Respuesta múltiple de empuje de pecho con balón medicinal,pectorals,triceps,shoulders,Párese con los pies separados al ancho de los hombros y sostenga un balón medicinal a la altura del pecho.,"Extiende los brazos hacia adelante, empujando el balón medicinal lejos de tu pecho.",Haz una pausa por un momento y luego lleva lentamente el balón medicinal hacia tu pecho.,Repita el número de repeticiones deseado.,,,,,,,,,,,
chest,medicine ball,Principiante,1305,"Empuje de pecho con balón medicinal, respuesta única",pectorals,triceps,shoulders,Párese con los pies separados al ancho de los hombros y sostenga el balón medicinal a la altura del pecho.,"Extiende los brazos hacia adelante, empujando el balón medicinal lejos de tu pecho.",Haz una pausa por un momento y luego lleva lentamente el balón medicinal hacia tu pecho.,Repita el número de repeticiones deseado.,,,,,,,,,,,
