bodyPart,equipment,level,id,name,target,secondaryMuscles/0,secondaryMuscles/1,instructions/0,instructions/1,instructions/2,instructions/3,instructions/4,instructions/5,secondaryMuscles/2,instructions/6,instructions/7,secondaryMuscles/3,instructions/8,secondaryMuscles/4,instructions/9,secondaryMuscles/5,instructions/10
chest,cable,Principiante,0188,mosca central del cable,pectorals,deltoids,triceps,Conecte cables a ambos lados de una máquina de cable a la altura del pecho.,Párese en el centro de la máquina con un pie ligeramente delante del otro.,Sujete las manijas con un agarre superior y extienda los brazos hacia los lados.,Mantenga los codos ligeramente doblados y una ligera inclinación hacia adelante.,Contraiga los músculos del pecho y lleve los brazos hacia adelante con un movimiento amplio.,"Haz una pausa por un momento en el centro, luego regresa lentamente los brazos a la posición inicial.",,Repita el número de repeticiones deseado.,,,,,,,
back,cable,Intermedio,0189,Remo con un brazo inclinado y cable,upper back,biceps,forearms,Párese frente a una máquina de cable con los pies separados al ancho de los hombros.,"Dobla ligeramente las rodillas e inclínate hacia adelante desde las caderas, manteniendo la espalda recta.","Sujete el mango del cable con una mano, con la palma hacia adentro, y extienda el brazo completamente.","Tire del mango del cable hacia su cuerpo, manteniendo el codo cerca de su costado, hasta que su mano llegue a la parte inferior del pecho.",Haga una pausa por un momento y luego extienda lentamente el brazo hacia la posición inicial.,Repita el ejercicio la cantidad de repeticiones deseada y luego cambie de lado.,,,,,,,,,
upper arms,cable,Intermedio,0190,curl con un brazo con cable,biceps,forearms,,Párese frente a la máquina de cable con los pies separados al ancho de los hombros.,Sujete el mango del cable con un agarre inferior y la palma hacia arriba.,Mantenga el codo cerca del costado y doble lentamente el antebrazo hacia el hombro.,"Haz una pausa por un momento en la parte superior, luego baja lentamente el antebrazo hasta la posición inicial.",Repita el número de repeticiones deseado.,,,,,,,,,,
chest,cable,Intermedio,1262,Apertura de pecho en declive con un brazo y cable,pectorals,shoulders,triceps,Coloque un mango en forma de D en una máquina de cable con polea baja y coloque el banco en un ángulo inclinado.,Acuéstese en el banco con la cabeza hacia la máquina y agarre el mango con la mano derecha.,"Extiende el brazo hacia arriba por encima del pecho, manteniendo el codo ligeramente doblado.","Con un movimiento controlado, baje el brazo hacia un costado hasta que su mano esté alineada con su hombro.","Haga una pausa por un momento, luego invierta el movimiento y vuelva a llevar el brazo a la posición inicial.","Repita el ejercicio la cantidad de repeticiones deseada, luego cambie al brazo izquierdo y repita el ejercicio.",,,,,,,,,
chest,cable,Intermedio,1263,Vuelo con un brazo en cable sobre pelota de ejercicios,pectorals,deltoids,triceps,Siéntese sobre una pelota de ejercicios con los pies apoyados en el suelo y la espalda recta.,"Sostenga un mango de cable en una mano y extienda el brazo hacia un costado, paralelo al suelo.",Mantenga el codo ligeramente doblado y la palma hacia adelante.,"Lentamente, cruce su cuerpo con el brazo, apretando los músculos del pecho.",Haga una pausa por un momento al final del movimiento y luego regrese lentamente a la posición inicial.,Repita el ejercicio la cantidad de repeticiones deseada y luego cambie de lado.,,,,,,,,,
chest,cable,Intermedio,1264,Vuelo inclinado con un brazo y cable sobre pelota de ejercicios,pectorals,deltoids,triceps,Siéntese sobre una pelota de ejercicios con los pies apoyados en el suelo y la espalda apoyada en un banco inclinado.,Sostenga un mango de cable en una mano con el brazo extendido y la palma hacia adentro.,"Manteniendo el codo ligeramente doblado, baje lentamente el brazo hacia un costado hasta que su mano esté alineada con su hombro.","Haga una pausa por un momento, luego apriete los músculos del pecho para llevar el brazo nuevamente a la posición inicial.",Repita el ejercicio la cantidad de repeticiones deseada y luego cambie de brazo.,,,,,,,,,,
chest,cable,Intermedio,1265,Press inclinado con un brazo y cable,pectorals,deltoids,triceps,Ajuste la máquina de cable a una posición de polea baja.,Siéntese en un banco inclinado de espaldas a la máquina de cable.,Sujete el mango con una mano y levántelo hasta la altura del hombro.,Coloque los pies firmemente en el suelo y mantenga una posición estable.,"Presione el mango hacia adelante y hacia arriba, extendiendo el brazo completamente.","Haga una pausa por un momento en la parte superior, luego baje lentamente el mango hasta la posición inicial.",,Repita el ejercicio la cantidad de repeticiones deseada y luego cambie de lado.,,,,,,,
chest,cable,Intermedio,1266,Press inclinado con un brazo y cable sobre pelota de ejercicios,pectorals,shoulders,triceps,Siéntese sobre una pelota de ejercicios con los pies apoyados en el suelo y la espalda apoyada en un banco inclinado.,Sostenga un mango de cable en una mano y coloque el brazo en un ángulo de 90 grados con el codo doblado.,"Presione el mango del cable hacia adelante y hacia arriba, extendiendo el brazo completamente.","Haga una pausa por un momento en la parte superior, luego baje lentamente el mango del cable hasta la posición inicial.",Repita el ejercicio la cantidad de repeticiones deseada y luego cambie al otro brazo.,,,,,,,,,,
chest,cable,Intermedio,0191,Cable con un brazo lateral inclinado,pectorals,deltoids,trapezius,"Párese con los pies separados al ancho de los hombros, frente a una máquina de cable.",Sujete el mango con una mano y dé un paso atrás para crear tensión en el cable.,"Inclínese hacia adelante desde la cintura, manteniendo la espalda recta y el centro del cuerpo contraído.","Extiende el brazo hacia un costado, paralelo al suelo, con una ligera flexión en el codo.","Lentamente regrese el brazo a la posición inicial, manteniendo el control durante todo el movimiento.",Repita el ejercicio la cantidad de repeticiones deseada y luego cambie de lado.,,,,,,,,,
shoulders,cable,Intermedio,0192,elevación lateral con un brazo y cable,delts,traps,triceps,"Párese con los pies separados al ancho de los hombros, frente a la máquina de cable.","Sujete el mango del cable con una mano, con la palma hacia abajo, y párese lo suficientemente lejos de la máquina para que haya tensión en el cable.",Mantenga el brazo recto y levántelo lentamente hacia un lado hasta que quede paralelo al suelo.,"Haz una pausa por un momento en la parte superior, luego baja lentamente el brazo hasta la posición inicial.",Repita el ejercicio la cantidad de repeticiones deseada y luego cambie de lado.,,,,,,,,,,
upper arms,cable,Intermedio,1633,curl de predicador con un brazo y cable,biceps,forearms,,Ajuste la máquina de cable de manera que la almohadilla de curl de predicador esté a la altura del pecho.,Párese frente a la máquina de cable con los pies separados al ancho de los hombros.,Sujete el mango del cable con un agarre supino y coloque la parte superior del brazo contra la almohadilla de curl de predicador.,Mantenga la espalda recta y el centro del cuerpo contraído.,"Gire lentamente el mango del cable hacia el hombro, manteniendo la parte superior del brazo contra la almohadilla.","Haz una pausa por un momento en la parte superior del movimiento, apretando los bíceps.",,Baje lentamente el mango del cable hasta la posición inicial.,Repita el número de repeticiones deseado.,,Cambia de brazo y repite el ejercicio.,,,,
chest,cable,Intermedio,1267,Press de cable con un brazo sobre pelota de ejercicios,pectorals,shoulders,triceps,Siéntese sobre una pelota de ejercicios con los pies apoyados en el suelo y la espalda recta.,"Sujete un mango de cable en una mano y coloque el brazo a la altura del pecho, con el codo doblado.",Coloque la otra mano sobre la cadera para mantener la estabilidad.,"Presione el mango del cable hacia adelante, extendiendo el brazo completamente.",Haga una pausa por un momento y luego regrese lentamente a la posición inicial.,Repita el ejercicio la cantidad de repeticiones deseada y luego cambie de brazo.,,,,,,,,,
back,cable,Intermedio,3563,polea con un brazo y cable,lats,biceps,forearms,Conecte un solo mango a una máquina de cable con polea alta.,Párese frente a la máquina con los pies separados al ancho de los hombros.,Sujete el mango con un agarre superior y extienda el brazo completamente.,Mantenga la espalda recta y el centro del cuerpo contraído.,"Tire el mango hacia abajo, hacia su costado, mientras mantiene el codo cerca del cuerpo.","Haz una pausa por un momento en la parte inferior del movimiento, apretando el músculo dorsal ancho.",,Suelte lentamente el mango hasta la posición inicial.,Repita el número de repeticiones deseado.,,Cambia de lado y repite el ejercicio con el otro brazo.,,,,
upper arms,cable,Intermedio,1635,curl de predicador invertido con un brazo y cable,biceps,forearms,,Ajuste la máquina de cable de modo que la polea esté en la posición más baja.,Párese frente a la máquina de cable con los pies separados al ancho de los hombros.,Sujete el mango del cable con un agarre por debajo de la mano y coloque la parte superior del brazo contra la almohadilla del banco del predicador.,Mantenga la espalda recta y el centro del cuerpo contraído durante todo el ejercicio.,"Lentamente doble el antebrazo hacia el bíceps, manteniendo la parte superior del brazo estacionaria contra la almohadilla.","Haz una pausa por un momento en la parte superior del movimiento, apretando el bíceps.",,Baje lentamente el mango del cable hasta la posición inicial.,Repita el número de repeticiones deseado.,,Cambia de brazo y repite el ejercicio.,,,,
back,cable,Intermedio,0193,Remo alto con un brazo y espalda recta (de rodillas),upper back,biceps,shoulders,Coloque un mango en una máquina de cable a la altura de la cintura.,Arrodíllate frente a la máquina de cable y sujeta el mango con una mano.,Mantenga la espalda recta y el centro del cuerpo contraído.,"Tire del mango hacia el pecho, apretando los omóplatos.",Haga una pausa por un momento en la parte superior del movimiento.,Suelte lentamente el mango hasta la posición inicial.,,Repita el número de repeticiones deseado.,Cambia de lado y repite el ejercicio con el otro brazo.,,,,,,
upper arms,cable,Intermedio,1723,flexión de tríceps con un brazo y cable,triceps,forearms,,Párese frente a una máquina de cable con un accesorio de barra recta a la altura del pecho.,Sujete la barra con un agarre superior y dé un paso atrás para crear tensión en el cable.,Coloca los pies separados al ancho de los hombros y dobla ligeramente las rodillas.,Mantenga la espalda recta y el centro del cuerpo contraído durante todo el ejercicio.,Comience con el brazo completamente extendido y perpendicular al suelo.,"Manteniendo el brazo superior estacionario, exhale y empuje la barra hacia abajo hasta que su brazo esté completamente extendido.",,"Haz una pausa por un momento, luego inhala y regresa lentamente a la posición inicial.",Repita el ejercicio la cantidad de repeticiones deseada y luego cambie de brazo.,,,,,,
upper arms,cable,Principiante,1636,curl con polea sobre la cabeza,biceps,forearms,shoulders,Conecte una barra recta a una máquina de cable de polea alta.,Párese frente a la máquina con los pies separados al ancho de los hombros.,Sujete la barra con un agarre por debajo de la mano y con las manos separadas al ancho de los hombros.,Mantenga los codos cerca de los costados y la parte superior de los brazos quieta.,"Exhala y gira la barra hacia la frente, manteniendo los brazos superiores estacionarios.","Haz una pausa por un momento en la parte inferior del movimiento, apretando los bíceps.",,"Inhala y regresa lentamente la barra a la posición inicial, extendiendo completamente los brazos.",Repita el número de repeticiones deseado.,,,,,,
upper arms,cable,Principiante,1637,curl con cable por encima de la cabeza sobre pelota de ejercicios,biceps,forearms,shoulders,Siéntese sobre una pelota de ejercicios y sujete el mango del cable con un agarre por debajo.,"Extiende los brazos completamente por encima de la cabeza, manteniendo los codos cerca de las orejas.","Lentamente, doble el cable hacia la frente, manteniendo los brazos superiores estacionarios.",Haga una pausa por un momento en la parte inferior del movimiento y luego regrese lentamente a la posición inicial.,Repita el número de repeticiones deseado.,,,,,,,,,,
upper arms,cable,Principiante,0194,Extensión de tríceps por encima de la cabeza con cable (conexión con cuerda),triceps,shoulders,,Conecte una cuerda a una máquina de cable en una posición alta.,Párese de espaldas a la máquina con los pies separados al ancho de los hombros.,"Sujete la cuerda con ambas manos, con las palmas una frente a la otra, y lleve las manos por encima de la cabeza.",Mantenga la parte superior de los brazos cerca de la cabeza y los codos apuntando hacia adelante.,Baje lentamente la cuerda detrás de su cabeza doblando los codos.,Haz una pausa por un momento y luego extiende los brazos hacia arriba hasta la posición inicial.,,Repita el número de repeticiones deseado.,,,,,,,
back,cable,Principiante,1319,Remo rotatorio con palma y cable,upper back,biceps,forearms,Coloque un mango en una máquina de cable a la altura de la cintura.,Párese frente a la máquina con los pies separados al ancho de los hombros.,"Sujete el mango con un agarre superior, con las palmas hacia abajo.","Da un paso atrás para crear tensión en el cable, manteniendo la espalda recta y las rodillas ligeramente dobladas.","Tire del mango hacia su cuerpo, girando las palmas hacia arriba mientras lo hace.",Aprieta los omóplatos al final del movimiento.,,Suelte lentamente el mango hasta la posición inicial.,Repita el número de repeticiones deseado.,,,,,,
upper arms,cable,Principiante,0195,rizo de predicador de cable,biceps,forearms,,Ajuste la máquina de cable de manera que la almohadilla de curl de predicador esté a la altura del pecho.,"Siéntese en el banco de curl predicador y coloque la parte superior de los brazos sobre la almohadilla, sujetando el accesorio de cable con un agarre por debajo.",Mantenga la espalda recta y los codos pegados a los costados.,"Lentamente, levante el cable hacia los hombros, apretando los bíceps en la parte superior del movimiento.",Haga una pausa por un momento y luego baje lentamente el accesorio del cable hasta la posición inicial.,Repita el número de repeticiones deseado.,,,,,,,,,
chest,cable,Principiante,1268,prensa de cable sobre pelota de ejercicios,pectorals,shoulders,triceps,Siéntese sobre una pelota de ejercicios con los pies apoyados en el suelo y las rodillas en un ángulo de 90 grados.,Sujete las asas del cable a la altura del pecho con las palmas hacia abajo y los codos doblados.,Contraiga el centro del cuerpo y presione los mangos del cable hacia adelante hasta que sus brazos estén completamente extendidos.,"Haga una pausa por un momento, luego libere lentamente la tensión y vuelva a llevar los mangos del cable a la posición inicial.",Repita el número de repeticiones deseado.,,,,,,,,,,
upper legs,cable,Principiante,0196,pasar el cable (con cuerda),glutes,hamstrings,lower back,Párese de espaldas a la máquina de cable con los pies separados al ancho de los hombros.,"Sujete la cuerda con ambas manos y dé un paso hacia adelante, creando tensión en el cable.","Dobla las caderas y baja la parte superior del cuerpo hasta que quede paralela al suelo, manteniendo la espalda recta.",Contrae los glúteos y los isquiotibiales para llevar el cuerpo hacia la posición inicial.,Repita el número de repeticiones deseado.,,,,,,,,,,
back,cable,Principiante,0198,polea baja con cable,lats,biceps,forearms,Ajuste la máquina de polea con cable de manera que el asiento esté a una altura cómoda y la almohadilla para la rodilla esté asegurada.,Siéntese en el asiento con la espalda recta y los pies apoyados en el suelo.,"Sujete la barra de cable con un agarre por encima de la mano, con los brazos ligeramente más separados que el ancho de los hombros.",Inclínese ligeramente hacia atrás y contraiga el centro del cuerpo.,"Tire la barra de cable hacia el pecho, apretando los omóplatos.","Haz una pausa por un momento en la parte inferior del movimiento, luego suelta lentamente la barra hasta la posición inicial.",,Repita el número de repeticiones deseado.,,,,,,,
back,cable,Principiante,0197,polea hacia abajo con cable (barra lateral profesional),lats,biceps,forearms,Ajuste la altura del asiento de manera que sus muslos queden paralelos al suelo y sus pies apoyados en el suelo.,"Sujete la barra dorsal con un agarre por encima de la mano, con una separación ligeramente mayor que el ancho de los hombros.","Siéntese e inclínese ligeramente hacia atrás, manteniendo el pecho erguido y la espalda recta.","Tire la barra hacia el pecho, apretando los omóplatos.","Haz una pausa por un momento en la parte inferior del movimiento, luego suelta lentamente la barra hasta la posición inicial.",Repita el número de repeticiones deseado.,,,,,,,,,
upper arms,cable,Principiante,1638,curl de bíceps con polea hacia abajo,biceps,forearms,,Coloque una barra recta en la máquina de cable en la configuración más alta.,Párese frente a la máquina con los pies separados al ancho de los hombros.,Sujete la barra con un agarre por debajo de la mano y con las manos separadas al ancho de los hombros.,Mantenga los codos cerca de los costados y la parte superior de los brazos quieta.,"Exhala y gira lentamente la barra hacia los muslos, manteniendo las muñecas rectas.","Haz una pausa por un momento en la parte inferior del movimiento, apretando los bíceps.",,"Inhala y regresa lentamente la barra a la posición inicial, extendiendo completamente los brazos.",Repita el número de repeticiones deseado.,,,,,,
upper arms,cable,Principiante,0201,empuje con cable,triceps,forearms,,Conecte una barra recta a una máquina de cable de polea alta.,Párese frente a la máquina con los pies separados al ancho de los hombros y una ligera flexión en las rodillas.,"Sujete la barra con un agarre por encima de la mano, con las manos separadas al ancho de los hombros.",Mantenga los codos cerca de los costados y la parte superior de los brazos quieta.,Exhala y empuja la barra hacia abajo hasta que tus codos estén completamente extendidos.,"Haz una pausa por un momento, luego inhala y regresa lentamente la barra a la posición inicial.",,Repita el número de repeticiones deseado.,,,,,,,
back,cable,Principiante,0199,flexiones con cable (brazo recto) v. 2,lats,triceps,shoulders,Conecte una barra recta a una máquina de cable de polea alta.,Párese frente a la máquina con los pies separados al ancho de los hombros y una ligera flexión en las rodillas.,"Sujete la barra con un agarre por encima de la mano, manteniendo los brazos rectos y las palmas hacia abajo.",Contraiga el centro del cuerpo y mantenga la espalda recta mientras exhala y empuja la barra hacia los muslos.,"Haz una pausa por un momento en la parte inferior, luego regresa lentamente la barra a la posición inicial mientras inhalas.",Repita el número de repeticiones deseado.,,,,,,,,,
upper arms,cable,Principiante,0200,flexión con cable (con fijación de cuerda),triceps,forearms,,Conecte un accesorio de cuerda a una polea alta en una máquina de cable.,Párese frente a la máquina con los pies separados al ancho de los hombros y una ligera flexión en las rodillas.,"Sujete la cuerda con un agarre superior, con las palmas una frente a la otra.",Mantenga los codos cerca de los costados y la parte superior de los brazos estacionarios durante todo el ejercicio.,Exhala y empuja la cuerda hacia abajo extendiendo los codos hasta que tus brazos estén completamente extendidos.,"Haga una pausa por un momento, luego inhale y regrese lentamente a la posición inicial permitiendo que los codos se flexionen.",,Repita el número de repeticiones deseado.,,,,,,,
shoulders,cable,Principiante,0202,Remo con cable para deltoides posteriores (estribos),delts,trapezius,rhomboids,Coloque un mango de estribo en una polea de cable baja y párese frente a la máquina.,"Sujete el mango con la mano izquierda y dé un paso atrás con el pie derecho, posicionando el cuerpo en un ligero ángulo.","Dobla ligeramente las rodillas e inclínate hacia adelante desde las caderas, manteniendo la espalda recta y el centro del cuerpo contraído.","Con el brazo izquierdo extendido y la palma hacia abajo, tire del mango hacia el pecho retrayendo el omóplato.","Haga una pausa por un momento en la parte superior del movimiento, apretando el omóplato.",Suelte lentamente el mango hasta la posición inicial y repita el ejercicio hasta obtener la cantidad de repeticiones deseada.,biceps,Cambia de lado y repite el ejercicio con el brazo derecho.,,,,,,,
shoulders,cable,Principiante,0203,Remo con cable para deltoides posteriores (con cuerda),delts,trapezius,rhomboids,Conecte un mango de cuerda a una máquina de cable con polea baja.,Párese frente a la máquina con los pies separados al ancho de los hombros.,"Sujete el mango de la cuerda con un agarre superior, con las palmas una frente a la otra.","Dobla ligeramente las rodillas e inclínate hacia adelante desde las caderas, manteniendo la espalda recta.","Mantenga los codos ligeramente doblados y tire de la cuerda hacia el pecho, apretando los omóplatos.","Haga una pausa por un momento en la parte superior del movimiento, luego libere lentamente la tensión y regrese a la posición inicial.",biceps,Repita el número de repeticiones deseado.,,,,,,,
upper arms,cable,Principiante,0204,tracción trasera por cable,triceps,shoulders,back,Coloque un mango en una máquina de cable con polea baja y párese de espaldas a la máquina.,Sujete el mango con un agarre superior y extienda los brazos hacia delante.,"Manteniendo los codos estacionarios, tire del mango hacia su cuerpo, apretando los tríceps al final del movimiento.",Regrese lentamente el mango a la posición inicial y repita el ejercicio hasta obtener la cantidad de repeticiones deseada.,,,,,,,,,,,
back,cable,Principiante,0205,pulldown trasero con cable,lats,biceps,rhomboids,Ajuste la máquina de cable de modo que la polea esté en la posición más alta.,Siéntese frente a la máquina con los pies apoyados en el suelo y las rodillas ligeramente flexionadas.,Sujete el cable con un agarre superior y las manos separadas un poco más que el ancho de los hombros.,"Inclínese ligeramente hacia atrás, manteniendo la espalda recta y el pecho erguido.","Tire el cable hacia abajo, en dirección al pecho, apretando los omóplatos.","Haga una pausa por un momento en la parte inferior del movimiento, luego suelte lentamente el cable hasta la posición inicial.",rear deltoids,Repita el número de repeticiones deseado.,,,,,,,
waist,cable,Principiante,0873,crujido inverso con cable,abs,hip flexors,,Conecte un cable a una polea baja y acuéstese boca arriba sobre una colchoneta.,Sujete el cable con ambas manos y extienda los brazos hacia el techo.,"Dobla las rodillas y levanta las piernas, llevando los muslos hacia el pecho.","Manteniendo estable la parte superior del cuerpo, flexione la pelvis hacia el pecho y levante las caderas del mat.","Haz una pausa por un momento en la parte superior, luego baja lentamente las caderas hasta la posición inicial.",Repita el número de repeticiones deseado.,,,,,,,,,
upper arms,cable,Principiante,0206,rizo inverso con cable,biceps,forearms,,Conecte una barra recta a una máquina de cable de polea baja.,Párese frente a la máquina con los pies separados al ancho de los hombros y las rodillas ligeramente dobladas.,Sujete la barra con un agarre por debajo de la mano y con las manos separadas al ancho de los hombros.,Mantenga los codos cerca de los costados y la parte superior de los brazos estacionarios durante todo el ejercicio.,"Exhala y levanta la barra hacia los hombros, contrayendo los bíceps.","Haz una pausa por un momento en la parte superior, apretando los bíceps.",,"Inhala y baja lentamente la barra a la posición inicial, extendiendo completamente los brazos.",Repita el número de repeticiones deseado.,,,,,,
upper arms,cable,Principiante,2406,Flexión de tríceps con agarre invertido y cable (barra SZ) (con Arm Blaster),triceps,forearms,,Coloque una barra recta en la máquina de cable en la configuración más alta.,Párese frente a la máquina de cable con los pies separados al ancho de los hombros.,"Sujete la barra con un agarre supino, con las palmas hacia arriba y las manos separadas al ancho de los hombros.",Mantenga los codos cerca de los costados y la parte superior de los brazos estacionarios durante todo el ejercicio.,Contrae los tríceps y empuja lentamente la barra hacia abajo hasta que tus brazos estén completamente extendidos.,Haz una pausa por un momento en la parte inferior y luego regresa lentamente la barra a la posición inicial.,,Repita el número de repeticiones deseado.,,,,,,,
upper arms,cable,Intermedio,1413,curl inverso con un brazo con cable,biceps,forearms,,Párese frente a una máquina de cable con los pies separados al ancho de los hombros.,"Sujete el mango del cable con un agarre inferior, con la palma hacia abajo.",Mantenga el codo cerca del costado y doble lentamente el antebrazo hacia el hombro.,"Haz una pausa por un momento en la parte superior, luego baja lentamente el antebrazo hasta la posición inicial.",Repita el número de repeticiones deseado.,,,,,,,,,,
